{
  "$schema": "https://example.invalid/ai-migration-framework/schemas/evidence-v3.schema.json",
  "schema_version": "3.0",
  "id": "EVID-0001",
  "phase": "verify",
  "slice_id": "SLICE-0001",
  "gate": "build",
  "status": "fail",
  "command": "replace with the exact reproducible command",
  "working_directory": "replace-with-project-relative-working-directory",
  "exit_code": 1,
  "environment": {"note": "replace with the exact execution environment"},
  "artifacts": [],
  "contracts": ["BEH-0001"],
  "recorded_at": "1970-01-01T00:00:00Z"
}
